{
  "$schema": "https://json-schema.org/draft/2020-12/schema",
  "$id": "https://everylastjoule.com/schema/region-snapshot.schema.json",
  "title": "Every Last Joule — per-region snapshot",
  "description": "Schema for data/snapshots/last-good/<regionId>.json. One snapshot per region per build. Single-region loaders emit the object below; multi-region loaders (aemo, brazil-ne, entsoe, ercot, ercot-native, norway) emit a Record<regionId, this>. The runtime source of truth is the RegionData interface in src/lib/types.ts. See dataset/SCHEMA.md for the human-readable description.",
  "type": "object",
  "required": [
    "regionId",
    "profile",
    "latestProfile",
    "totalTWh",
    "peakGW",
    "lastUpdated",
    "lastSuccessAt",
    "sourceProvenance"
  ],
  "properties": {
    "regionId": {
      "type": "string",
      "pattern": "^[a-z0-9][a-z0-9-]*$",
      "description": "Stable ID matching src/lib/regions.ts. Kebab-case."
    },
    "profile": {
      "type": "array",
      "description": "30-day trailing average curtailment in GW, one value per UTC hour (index 0 = 00:00\u201301:00 UTC).",
      "minItems": 24,
      "maxItems": 24,
      "items": {"type": "number", "minimum": 0}
    },
    "latestProfile": {
      "description": "Single-day latest snapshot in GW per UTC hour. Null when the loader cannot pin a single most-recent UTC day (e.g. when the upstream feed is built from a multi-day rolling window without a daily anchor). Loaders that publish a same-day raw curve emit a 24-element array; loaders that don't emit null.",
      "oneOf": [
        {
          "type": "array",
          "minItems": 24,
          "maxItems": 24,
          "items": {"type": "number", "minimum": 0}
        },
        {"type": "null"}
      ]
    },
    "totalTWh": {
      "type": "number",
      "minimum": 0,
      "description": "30-day trailing total curtailment in TWh."
    },
    "peakGW": {
      "type": "number",
      "minimum": 0,
      "description": "30-day trailing peak hourly GW."
    },
    "lastUpdated": {
      "type": "string",
      "description": "Calibration-anchor date: YYYY, YYYY-Q#, or ISO-8601."
    },
    "lastSuccessAt": {
      "type": "string",
      "format": "date-time",
      "description": "ISO-8601 UTC timestamp when this snapshot was last successfully refreshed. Cache fallbacks use this to distinguish recent cached data from degraded stale data."
    },
    "sourceNote": {
      "type": "string",
      "description": "Optional human-readable provenance string surfaced in the dashboard tooltip and paper Usage Notes. Absent on legacy snapshots that pre-date the provenance-string convention."
    },
    "sourceStatus": {
      "type": ["string", "null"],
      "enum": ["live", "cached", "degraded", null],
      "description": "Per-fetch freshness. Whether the last fetch was fresh (live), a recent withFallback snapshot (cached), or a stale withFallback snapshot beyond the configured staleness threshold (degraded). A loader that publishes its own fallback per record (eia-vre-bas) also marks a record degraded when it stands in for a failed fetch: a copy of the last-good record of any age, or a record with no generation series; both keep the time of the last real fetch, or 1970-01-01T00:00:00.000Z when there is none. Distinct from sourceProvenance, which records what kind of upstream link the region has."
    },
    "sourceProvenance": {
      "type": "string",
      "enum": ["verified", "official-lead", "modelled-fallback"],
      "description": "Required per-region declaration of the upstream link kind, orthogonal to confidenceTier. verified = snapshot value comes from a verified upstream feed or anchor. official-lead = authoritative source exists and loader is wired/scaffolded but the live path is not producing usable data (geoblocked, auth-gated, parser pending). modelled-fallback = no verified upstream link; snapshot is typical-shape scaled to an anchor or otherwise estimated. The 'exclude' status never appears in snapshots; excluded regions are not emitted. See docs/methodology/tier-classification-guide.md#source-provenance-orthogonal-to-tier."
    },
    "fuelShare": {
      "type": "object",
      "description": "Optional fuel-type split of the curtailed energy, fractions 0\u20131. Loaders that pull technology-separated feeds (e.g. ONS Brazil) populate this; loaders that don't omit the field. The runtime keys in src/lib/types.ts are {solar, wind, hydro}; the historical snapshot corpus also contains {geothermal} from earlier loader generations. Keys outside this enum should be treated as data-quality issues.",
      "additionalProperties": {"type": "number", "minimum": 0, "maximum": 1},
      "propertyNames": {"enum": ["solar", "wind", "hydro", "geothermal"]}
    },
    "uncertaintyLowGW": {
      "type": "number",
      "minimum": 0,
      "description": "Lower bound of the per-tier envelope on peakGW (max(0, peakGW \u2212 \u03b4)). Half-width \u03b4 is per-tier: 2\u03c3 from the 5-year backfill where available, else \u00b115% (T1) / \u00b120% (T2) / \u00b140% (T3). Derived deterministically by src/lib/uncertainty.ts::deriveTier; see docs/methodology/uncertainty.md for the methodology."
    },
    "uncertaintyHighGW": {
      "type": "number",
      "minimum": 0,
      "description": "Upper bound of the per-tier envelope on peakGW (peakGW + \u03b4). Same per-tier \u03b4 as uncertaintyLowGW."
    },
    "observedStdGW": {
      "type": "number",
      "minimum": 0,
      "description": "Empirical standard deviation of historical annual peakGW, used for T1 2\u03c3 uncertainty bounds when available."
    },
    "confidenceTier": {
      "type": "string",
      "enum": [
        "T1-live-TSO",
        "T1a-live-tso",
        "T1b-live-domestic-anchored",
        "T1c-live-neighbour-anchored",
        "T2-annual-calibrated",
        "T3-modelled",
        "T4-structural-gap"
      ],
      "description": "Deterministic source-quality classification. Per B4 Option B (locked 2026-04-25, see docs/proposals/b4-option-b-decision.md), T1 is subdivided into T1a (own-jurisdiction calibration rate; \u00b115%), T1b (domestic-stat-agency rate or modelled-share split; empirical \u00b150%), and T1c (neighbour-extrapolated rate; empirical \u00b135.5%). T2 = static anchored to a published annual (Ember, IRENA, GGFR, TSO annual; \u00b120%). T3 = static annual + typical-shape profile (solar/wind/hydro-seasonal/mixed/overnight; \u00b140%). T4 is reserved in the enum for symmetry but is never emitted \u2014 structural-gap regions do not appear in the dataset at all. The pre-2026-04-25 single label \"T1-live-TSO\" is retained for backward compatibility on legacy snapshots; new emissions use T1a/T1b/T1c. Derived deterministically by src/lib/uncertainty.ts::deriveTier; see docs/methodology/uncertainty.md."
    },
    "generationProfile": {
      "type": "array",
      "description": "30-day trailing average gross renewable generation in GW, one value per UTC hour (index 0 = 00:00\u201301:00 UTC). Companion to profile (curtailment). Populated progressively by loaders that expose two-sided data (generation + curtailment); absence means the loader has not yet exposed generation as a first-class field.",
      "minItems": 24,
      "maxItems": 24,
      "items": {"type": "number", "minimum": 0}
    },
    "generationTotalTWh": {
      "type": "number",
      "minimum": 0,
      "description": "Trailing-30-day total gross renewable generation in TWh. Companion to totalTWh (curtailment). generationTotalTWh >= totalTWh must hold (cannot curtail more than was generated)."
    },
    "generationBasis": {
      "type": "string",
      "enum": ["measured-independent", "derived-from-generation", "anchor-implied"],
      "description": "How this record's generation relates to its curtailment, and therefore whether totalTWh / generationTotalTWh may be published as a share. \"measured-independent\": the source publishes curtailment as its own measured quantity alongside generation for the same window, so the ratio is an observation. \"derived-from-generation\": curtailment was computed AS generation x a calibration rate, so the ratio returns that rate — an input, never a finding. \"anchor-implied\": generation is measured but the curtailment magnitude is a published annual anchor spread across the window, so the ratio is an implied rate. Absent means the loader emits no generation. Only \"measured-independent\" is surfaced as a share; src/lib/generation-share.ts is the single gate."
    },
    "wasteStatus": {
      "type": "string",
      "enum": ["measured", "measured-zero", "unpublished"],
      "description": "Whether profile is TSO-published waste. measured = operator publishes a curtailment/spill/constraint series. measured-zero = that series is zero in the window (still needs the zero-allowlist when live-tier). unpublished = generation (or grid presence) is collected and the operator does not publish waste; profile is zeros and must not be read as a finding. Such a record carries generationProfile, except one that stands in for a fetch that failed with no usable earlier copy (sourceStatus degraded, no generationProfile): it is published but does not belong in a committed snapshot, and scripts/validate-snapshots.ts rejects it there. Absent on legacy snapshots."
    }
  },
  "additionalProperties": false
}
