{"regionId":"quebec","profile":[0.061643835616438346,0.061643835616438346,0.061643835616438346,0.061643835616438346,0.061643835616438346,0.061643835616438346,0.061643835616438346,0.061643835616438346,0.061643835616438346,0.061643835616438346,0.061643835616438346,0.061643835616438346,0.061643835616438346,0.061643835616438346,0.061643835616438346,0.061643835616438346,0.061643835616438346,0.061643835616438346,0.061643835616438346,0.061643835616438346,0.061643835616438346,0.061643835616438346,0.061643835616438346,0.061643835616438346],"latestProfile":null,"totalTWh":0.04438356164383561,"peakGW":0.061643835616438346,"lastUpdated":"2024","lastSuccessAt":"2026-06-18T02:31:20.020Z","sourceNote":"Typical-shape fallback: Hydro-Quebec Sustainability Report live feed unavailable (Hydro-Quebec reports do not expose machine-readable hourly spill data); export-absorbed spring/summer surplus anchored at ~0.3 TWh/yr. — current 30-day seasonal factor 1.80×","confidenceTier":"T3-modelled","uncertaintyLowGW":0.03698630136986301,"uncertaintyHighGW":0.08630136986301368,"sourceStatus":"live","sourceProvenance":"modelled-fallback"}