{"regionId":"india-karnataka","profile":[1.0473386735188113e-30,0.014025385740328555,0.0458846694345759,0.08562382077643972,0.12333227327071535,0.1501137243638464,0.15977969929170596,0.1501137243638464,0.12333227327071535,0.08562382077643972,0.0458846694345759,0.014025385740328555,1.0473386735188113e-30,0,0,0,0,0,0,0,0,0,0,0],"latestProfile":null,"totalTWh":0.02993218339390553,"peakGW":0.15977969929170596,"lastUpdated":"2026","lastSuccessAt":"2026-10-18T22:53:59.729Z","sourceNote":"CEA gen-re.cea.gov.in daily Excel, State-Wise sheet (470-day CSV; trailing-365-day solar 17.84 TWh). Annual curtailed energy = CEA generation × Ember India 2024 rate 2% / (1 − rate) = 0.36 TWh. Hourly shape is synthetic. Only the generation denominator is from a primary official source.","confidenceTier":"T3-modelled","uncertaintyLowGW":0.09586781957502358,"uncertaintyHighGW":0.22369157900838835,"sourceProvenance":"official-lead","sourceStatus":"cached"}