{"regionId":"china-hainan","profile":[0.0017949609432670098,0.002891279995383236,0.003803275587040463,0.004318506644934698,0.004318506644934698,0.003803275587040463,0.002891279995383236,0.0017949609432670098,0.0007783260426633461,0.00011228092369754556,0,0,0,0,0,0,0,0,0,0,0,0,0.00011228092369754489,0.0007783260426633467],"latestProfile":null,"totalTWh":0.000821917808219178,"peakGW":0.004318506644934698,"lastUpdated":"2024","lastSuccessAt":"2026-05-03T06:08:55.985Z","sourceNote":"Typical-shape fallback: NEA 2024 provincial RE monitoring bulletin is not an hourly machine-readable feed; Hainan solar curtailment ~0.01 TWh/yr; NEA 2024 provincial RE monitoring bulletin (99.8% PV utilisation; near-zero).","confidenceTier":"T3-modelled","uncertaintyLowGW":0.0025911039869608186,"uncertaintyHighGW":0.006045909302908578,"sourceStatus":"live","sourceProvenance":"modelled-fallback"}