{"regionId":"japan-kyushu","profile":[0.53675,0.6724333333333333,0.8590666666666668,1.0610666666666666,1.0049666666666668,0.6621333333333334,0.3739666666666666,0.08871666666666667,0.003616666666666667,0,0,0,0,0,0,0,0,0,0,0,0,0,0.03621666666666667,0.29456666666666664],"latestProfile":[0,0,0,0,0,0,0,0,0,0,0,0,0,0,0,0,0,0,0,0,0,0,0,0],"totalTWh":0.167805,"peakGW":1.0610666666666666,"lastUpdated":"2026-06-18T02:00:00.000Z","lastSuccessAt":"2026-06-18T02:28:15.899Z","sourceNote":"Kyushu Electric Power T&D (九州電力送配電) area supply/demand CSV (eria_jukyu_YYYYMM_09.csv) — direct 太陽光出力制御量+風力出力制御量 columns (MW, 30-min, Shift-JIS, quoted fields + YYYYMMDD dates).","fuelShare":{"solar":0.96385387801317,"wind":0.036146121986829954},"sourceStatus":"live","confidenceTier":"T1a-live-tso","uncertaintyLowGW":0.9019066666666666,"uncertaintyHighGW":1.2202266666666666,"sourceProvenance":"verified"}