{"regionId":"india-kerala","profile":[0.00012813657613305513,0.00017758661087895593,0.0004940172432143875,0.0009803794872789398,0.0015070709950524665,0.0019476389837432596,0.0022001600910710865,0.0022075483491856797,0.0019693002605062028,0.0015415291102493182,0.0010252861773037618,0.0005463121913538026,0.00023370600283875083,0.00018425596809285003,0.0001864640117620469,0.0001864640117620469,0.00018425596809285003,0.0001799903552815473,0.00017395786779197058,0.00016656960967737758,0.00015832907851860397,0.00014979785289599853,0.0001415573217372249,0.00013416906362263186],"latestProfile":null,"totalTWh":0.0005041344956413445,"peakGW":0.0022075483491856797,"lastUpdated":"2026","lastSuccessAt":"2026-10-19T01:31:28.721Z","sourceNote":"CEA gen-re.cea.gov.in daily Excel, State-Wise sheet (470-day CSV; trailing-365-day solar 0.474 TWh + wind 0.134 TWh). Annual curtailed energy = CEA generation × Ember India 2024 rate 1% / (1 − rate) = 0.006 TWh. Hourly shape is synthetic. Only the generation denominator is from a primary official source.","fuelShare":{"solar":0.7799680516443521,"wind":0.22003194835564788},"confidenceTier":"T3-modelled","uncertaintyLowGW":0.0013245290095114078,"uncertaintyHighGW":0.0030905676888599515,"sourceProvenance":"official-lead","sourceStatus":"cached"}