{"regionId":"india-gujarat","profile":[0.08909883527454245,0.08909883527454245,0.08909883527454245,0.08909883527454245,0.08909883527454245,0.08909883527454245,0.08909883527454245,0.08909883527454245,0.08909883527454245,0.08909883527454245,0.08909883527454245,0.08909883527454245,0.08909883527454245,0.08909883527454245,0.08909883527454245,0.08909883527454245,0.08909883527454245,0.08909883527454245,0.08909883527454245,0.08909883527454245,0.08909883527454245,0.08909883527454245,0.08909883527454245,0.08909883527454245],"latestProfile":null,"totalTWh":0.06415116139767055,"peakGW":0.08909883527454245,"lastUpdated":"2026-10-16","lastSuccessAt":"2026-10-19T07:47:08.542Z","sourceProvenance":"verified","sourceNote":"Grid-India NLDC REMC daily VRE reports — MEASURED RE State wind+solar curtailment (MU; 1 MU = 1 GWh) from the first table (\"VRE Curtailment Details due to real time system constraints\"), parsed from the published DD.MM.YYYY_NLDC_REMC_REPORT series. 601 published days: solar 944.70 GWh + wind 340.46 GWh, annualised to 780.5 GWh/yr. Latest published day: 2026-10-16. NOT a live feed — daily PDFs in arrears, CDN reachable from India only. Not GSLDC DSM / REC / \"certificates blocked\" pages (those are not operational curtailment). Emergency TRAS Down table excluded (often MW with 0 MU). Flat 24/7 profile: the source gives daily energy only, so no intraday shape is claimed.","fuelShare":{"solar":0.7350818760846883,"wind":0.2649181239153116},"confidenceTier":"T2-annual-calibrated","uncertaintyLowGW":0.07127906821963395,"uncertaintyHighGW":0.10691860232945094,"sourceStatus":"live"}