{"regionId":"china-shandong","profile":[0.8077324244701545,1.3010759979224564,1.7114740141682085,1.9433279902206144,1.9433279902206144,1.7114740141682085,1.3010759979224564,0.8077324244701545,0.35024671919850575,0.050526415663895506,0,0,0,0,0,0,0,0,0,0,0,0,0.0505264156638952,0.35024671919850603],"latestProfile":null,"totalTWh":0.3698630136986301,"peakGW":1.9433279902206144,"lastUpdated":"2024","lastSuccessAt":"2026-05-03T06:08:37.861Z","sourceNote":"Typical-shape fallback: NEA 2024 provincial RE monitoring bulletin is not an hourly machine-readable feed; Shandong solar curtailment ~4.5 TWh/yr; NEA 2024 provincial RE monitoring bulletin (96.3% PV utilisation rate).","confidenceTier":"T3-modelled","uncertaintyLowGW":1.1659967941323686,"uncertaintyHighGW":2.7206591863088603,"sourceStatus":"live","sourceProvenance":"modelled-fallback"}