{"regionId":"cyprus","profile":[0,0,0,0,0.0011228092369754555,0.00778326042663346,0.017949609432670096,0.02891279995383236,0.03803275587040463,0.043185066449346984,0.043185066449346984,0.03803275587040463,0.02891279995383236,0.017949609432670096,0.00778326042663346,0.0011228092369754555,0,0,0,0,0,0,0,0],"latestProfile":null,"totalTWh":0.00821917808219178,"peakGW":0.043185066449346984,"lastUpdated":"2024","lastSuccessAt":"2026-06-18T02:28:45.884Z","sourceNote":"Typical-shape fallback: TSOC/EAC live feed unavailable (HTTP 403 for https://tsoc.org.cy/); isolated-grid solar curtailment scaled to ~0.1 TWh/yr.","confidenceTier":"T3-modelled","uncertaintyLowGW":0.02591103986960819,"uncertaintyHighGW":0.06045909302908578,"sourceStatus":"live","sourceProvenance":"modelled-fallback"}