{"regionId":"india-east","profile":[0.00006504694764470033,0.00045090235883707983,0.0010398625755474024,0.001674985672476917,0.002203325906500321,0.0025018112283529273,0.0025018112283529273,0.002203325906500321,0.001674985672476917,0.0010398625755474024,0.00045090235883707983,0.00006504694764470033,0,0,0,0,0,0,0,0,0,0,0,0],"latestProfile":null,"totalTWh":0.0004761560813615609,"peakGW":0.0025018112283529273,"lastUpdated":"2026","lastSuccessAt":"2026-10-18T22:54:00.355Z","sourceNote":"CEA gen-re.cea.gov.in daily Excel, Eastern residual excluding Odisha (Bihar + West Bengal + Jharkhand + Sikkim; 470-day CSV; trailing-365-day solar 0.57 TWh). Annual curtailed energy = CEA generation × Ember India 2024 rate 1% / (1 − rate) = 0.006 TWh. Odisha is its own region and is not counted here. Hourly shape is synthetic. Only the generation denominator is from a primary official source.","confidenceTier":"T3-modelled","uncertaintyLowGW":0.0015010867370117563,"uncertaintyHighGW":0.0035025357196940984,"sourceProvenance":"official-lead","sourceStatus":"cached"}