{"regionId":"saskatchewan","profile":[0.014241659722894017,0.013767560851193954,0.01352214921667877,0.01352214921667877,0.013767560851193954,0.014241659722894017,0.014912136777158027,0.015733300110753613,0.01664918879953281,0.017597386542932938,0.01851327523171213,0.01933443856530772,0.02000491561957173,0.02047901449127179,0.020724426125786975,0.020724426125786975,0.02047901449127179,0.02000491561957173,0.01933443856530772,0.01851327523171213,0.017597386542932938,0.01664918879953281,0.015733300110753613,0.014912136777158027],"latestProfile":null,"totalTWh":0.012328767123287671,"peakGW":0.020724426125786975,"lastUpdated":"2024","lastSuccessAt":"2026-06-18T02:31:22.358Z","sourceNote":"Typical-shape fallback: SaskPower 2024 live feed unavailable (SaskPower annual reports do not expose hourly wind curtailment data); growing wind curtailment anchored at ~0.15 TWh/yr.","confidenceTier":"T3-modelled","uncertaintyLowGW":0.012434655675472184,"uncertaintyHighGW":0.029014196576101766,"sourceStatus":"live","sourceProvenance":"modelled-fallback"}