{"regionId":"ethiopia","profile":[0.6575342465753429,0.6575342465753429,0.6575342465753429,0.6575342465753429,0.6575342465753429,0.6575342465753429,0.6575342465753429,0.6575342465753429,0.6575342465753429,0.6575342465753429,0.6575342465753429,0.6575342465753429,0.6575342465753429,0.6575342465753429,0.6575342465753429,0.6575342465753429,0.6575342465753429,0.6575342465753429,0.6575342465753429,0.6575342465753429,0.6575342465753429,0.6575342465753429,0.6575342465753429,0.6575342465753429],"latestProfile":null,"totalTWh":0.4734246575342468,"peakGW":0.6575342465753429,"lastUpdated":"2024","lastSuccessAt":"2026-06-18T02:28:47.940Z","sourceNote":"Typical-shape fallback: EEP live feed unavailable (EEP public pages expose no machine-readable hourly GERD/hydro spill feed); GERD/cascade hydro spill ~5 TWh/yr calibrated to Blue Nile Kiremt monsoon (NH summer peak Jul-Aug). — current 30-day seasonal factor 1.15×","confidenceTier":"T3-modelled","uncertaintyLowGW":0.3945205479452057,"uncertaintyHighGW":0.9205479452054801,"sourceStatus":"live","sourceProvenance":"modelled-fallback"}