{"regionId":"china-zhejiang","profile":[0.10977619699173109,0.15236469541851333,0.18819008805942858,0.208799330375198,0.20945376140057181,0.19010878274266924,0.15541689788775084,0.11375390469269002,0.075530878505288,0.051417601062389656,0.049368733951232355,0.051558502840820586,0.053346441652191275,0.054610705310058114,0.05526513633543194,0.05526513633543194,0.054610705310058114,0.053346441652191275,0.051558502840820586,0.049368733951232355,0.046926364114487834,0.04439783679875416,0.04644670390991143,0.07089873977895528],"latestProfile":null,"totalTWh":0.06575342465753424,"peakGW":0.20945376140057181,"lastUpdated":"2024","lastSuccessAt":"2026-05-03T06:08:47.958Z","sourceNote":"Typical-shape fallback: NEA 2024 provincial RE monitoring bulletin is not an hourly machine-readable feed; Zhejiang coastal mixed wind+solar curtailment ~0.8 TWh/yr; NEA 2024 provincial RE monitoring bulletin.","fuelShare":{"wind":0.5,"solar":0.5},"confidenceTier":"T3-modelled","uncertaintyLowGW":0.12567225684034308,"uncertaintyHighGW":0.2932352659608005,"sourceStatus":"live","sourceProvenance":"modelled-fallback"}