{"regionId":"india-rajasthan","profile":[1.3098921232692196e-29,0.1754135770174902,0.5738732712812724,1.0708853901331588,1.542499836842846,1.8774517747747181,1.9983427982980042,1.8774517747747181,1.542499836842846,1.0708853901331588,0.5738732712812724,0.1754135770174902,1.3098921232692196e-29,0,0,0,0,0,0,0,0,0,0,0],"latestProfile":null,"totalTWh":0.37435771495190917,"peakGW":1.9983427982980042,"lastUpdated":"2026","lastSuccessAt":"2026-10-18T22:53:59.855Z","sourceNote":"CEA gen-re.cea.gov.in daily Excel, State-Wise sheet (470-day CSV; trailing-365-day solar 71.36 TWh). Annual curtailed energy = CEA generation × Ember India 2024 rate 6% / (1 − rate) = 4.55 TWh. Hourly shape is synthetic. Only the generation denominator is from a primary official source. RRVPNL re-curtailment PDFs for Jan–May 2026 sum to 0.052 TWh (research extraction, issue #964) — >50× below this modelled anchor; that floor is not annualised and is not what the dashboard plots.","confidenceTier":"T3-modelled","uncertaintyLowGW":1.1990056789788026,"uncertaintyHighGW":2.797679917617206,"sourceProvenance":"official-lead","sourceStatus":"cached"}