{"regionId":"new-zealand-hydro","profile":[0,0,0,0,0,0,0,0,0,0,0,0,0,0,0,0,0,0,0,0,0,0,0,0],"latestProfile":null,"totalTWh":0,"peakGW":0,"lastUpdated":"2026-08-01T04:56:33.957Z","lastSuccessAt":"2026-08-01T04:55:54.522Z","sourceNote":"EMI DispatchNodalPricesAndVolumes ≤$0/MWh nodal price signal — Waitaki corridor (BEN/ROX/CYD/TWZ/TKU), Manapouri (MAT), Waikato (ARO/ATI/KAW/OHA/WAI). CAVEAT: ≤$0 nodal prices are rare in NZ — nine months of EMI final pricing (2025-10 → 2026-06) hit ≤$0 at hydro nodes on one day only, flooring at $0.010 otherwise — so this series reads a genuine zero most of the time and is a floor on NZ hydro spill, not a measure of it.","fuelShare":{"hydro":1},"sourceStatus":"live","confidenceTier":"T1a-live-tso","uncertaintyLowGW":0,"uncertaintyHighGW":0,"sourceProvenance":"verified"}