{"regionId":"uae","profile":[0,0,0.003368427710926367,0.023349781279900384,0.05384882829801029,0.08673839986149708,0.11409826761121389,0.12955519934804094,0.12955519934804094,0.11409826761121389,0.08673839986149708,0.05384882829801029,0.023349781279900384,0.003368427710926367,0,0,0,0,0,0,0,0,0,0],"latestProfile":null,"totalTWh":0.024657534246575342,"peakGW":0.12955519934804094,"lastUpdated":"2025","lastSuccessAt":"2026-05-06T07:42:05.969Z","sourceNote":"No public hourly curtailment feed; DEWA/EWEC public pages do not expose hourly solar curtailment. Calibration anchor ~0.3 TWh/yr (200–330 GWh) solar curtailment driven by Al Dhafra 2 GW solar + 5.6 GW Barakah nuclear baseload duck-curve. Sources: EWEC Statistical Report 2023/2024; Abu Dhabi DoE Technical Report 2023; IEA Electricity 2026. T3-modelled, ±40% envelope.","confidenceTier":"T3-modelled","uncertaintyLowGW":0.07773311960882456,"uncertaintyHighGW":0.18137727908725731,"sourceStatus":"live","sourceProvenance":"modelled-fallback"}