{"regionId":"manitoba","profile":[0.020525747869639413,0.020146468772279366,0.019950139464667217,0.019950139464667217,0.020146468772279366,0.020525747869639413,0.02106212951305062,0.021719060179927092,0.02245177113095045,0.02321032932567055,0.023943040276693906,0.024599970943570373,0.025136352586981582,0.025515631684341636,0.025711960991953782,0.025711960991953782,0.025515631684341636,0.025136352586981582,0.024599970943570373,0.023943040276693906,0.02321032932567055,0.02245177113095045,0.021719060179927092,0.02106212951305062],"latestProfile":null,"totalTWh":0.01643835616438356,"peakGW":0.025711960991953782,"lastUpdated":"2024","lastSuccessAt":"2026-05-06T07:42:31.483Z","sourceNote":"Typical-shape fallback: Manitoba Hydro corporate reports live feed unavailable (Manitoba Hydro corporate reports do not expose hourly wind/hydro curtailment data); wind plus hydro curtailment anchored at ~0.2 TWh/yr.","fuelShare":{"wind":0.6,"hydro":0.4},"confidenceTier":"T3-modelled","uncertaintyLowGW":0.015427176595172268,"uncertaintyHighGW":0.0359967453887353,"sourceStatus":"live","sourceProvenance":"modelled-fallback"}