{"regionId":"japan-kansai","profile":[0.02486666666666667,0.033966666666666666,0.03974576271186441,0.04413333333333333,0.03005,0.015716666666666667,0.0033,0,0,0,0,0,0,0,0,0,0,0,0,0,0,0,0,0.004066666666666666],"latestProfile":[0,0,0,0,0,0,0,0,0,0,0,0,0,0,0,0,0,0,0,0,0,0,0,0],"totalTWh":0.0058555,"peakGW":0.04413333333333333,"lastUpdated":"2026-06-18T01:30:00.000Z","lastSuccessAt":"2026-06-18T02:28:14.472Z","sourceNote":"Kansai Transmission and Distribution (関西電力送配電) area supply/demand CSV (eria_jukyu_YYYYMM_06.csv) — direct 太陽光出力制御量+風力出力制御量 columns (MW, 30-min, Shift-JIS). Solar-dominant.","fuelShare":{"solar":1,"wind":0},"sourceStatus":"live","confidenceTier":"T1a-live-tso","uncertaintyLowGW":0.03751333333333333,"uncertaintyHighGW":0.05075333333333333,"sourceProvenance":"verified"}