{"regionId":"nt-pilbara","profile":[0.03589921886534019,0.05782559990766472,0.07606551174080926,0.08637013289869397,0.08637013289869397,0.07606551174080926,0.05782559990766472,0.03589921886534019,0.01556652085326692,0.002245618473950911,0,0,0,0,0,0,0,0,0,0,0,0,0.0022456184739508976,0.015566520853266933],"latestProfile":null,"totalTWh":0.01643835616438356,"peakGW":0.08637013289869397,"lastUpdated":"2024","lastSuccessAt":"2026-06-18T02:29:47.125Z","sourceNote":"Typical-shape fallback: NT/Pilbara live feed unavailable (HTTP 403 for https://www.horizonpower.com.au/); calibration anchor ~0.2 TWh/yr captive solar curtailment.","confidenceTier":"T3-modelled","uncertaintyLowGW":0.05182207973921638,"uncertaintyHighGW":0.12091818605817156,"sourceStatus":"live","sourceProvenance":"modelled-fallback"}