{"regionId":"nigeria","profile":[0,0,0,0,0,0,0.0005614046184877278,0.00389163021331673,0.008974804716335048,0.01445639997691618,0.019016377935202316,0.021592533224673492,0.021592533224673492,0.019016377935202316,0.01445639997691618,0.008974804716335048,0.00389163021331673,0.0005614046184877278,0,0,0,0,0,0],"latestProfile":null,"totalTWh":0.00410958904109589,"peakGW":0.021592533224673492,"lastUpdated":"2024","lastSuccessAt":"2026-06-18T08:27:28.895Z","sourceNote":"Typical-shape fallback: Niggrid live feed unavailable (probe failed). Calibration anchor ~0.05 TWh/yr Nigeria solar curtailment (TCN/Ember 2024).","confidenceTier":"T3-modelled","uncertaintyLowGW":0.012955519934804096,"uncertaintyHighGW":0.03022954651454289,"sourceStatus":"live","sourceProvenance":"official-lead"}