{"regionId":"bangladesh","profile":[0,0,0,0,0,0,0,0,0,0,0,0,0,0,0,0,0,0,0,0,0,0,0,0],"latestProfile":null,"totalTWh":0,"peakGW":0,"lastUpdated":"2026-09-06T05:00:00.000Z","lastSuccessAt":"2026-09-06T05:00:00.000Z","sourceNote":"PGCB hourly solar generation (erp.powergrid.gov.bd), 51 readings 2026-09-03T18:00:00.000Z to 2026-09-06T05:00:00.000Z (peak 607 MW). Waste unpublished — PGCB publishes generation, not curtailment, and Bangladesh has no published national curtailment rate. The previous 0.1 TWh/yr repo estimate is dropped. Missing ≠ zero. Not T1a.","sourceStatus":"cached","sourceProvenance":"official-lead","wasteStatus":"unpublished","generationProfile":[0.0035,0.0675,0.165,0.2365,0.338,0.4086666666666667,0.5565,0.5345,0.345,0.2885,0.1865,0.0885,0.0055,0,0,0,0,0,0,0,0,0,0,0],"generationTotalTWh":0.09672499999999998,"confidenceTier":"T3-modelled","uncertaintyLowGW":0,"uncertaintyHighGW":0}