{"regionId":"colombia","profile":[2.003648454794521,2.003648454794521,2.003648454794521,2.003648454794521,2.003648454794521,2.003648454794521,2.003648454794521,2.003648454794521,2.003648454794521,2.003648454794521,2.003648454794521,2.003648454794521,2.003648454794521,2.003648454794521,2.003648454794521,2.003648454794521,2.003648454794521,2.003648454794521,2.003648454794521,2.003648454794521,2.003648454794521,2.003648454794521,2.003648454794521,2.003648454794521],"latestProfile":null,"totalTWh":1.442626887452055,"peakGW":2.003648454794521,"lastUpdated":"2026","lastSuccessAt":"2026-06-18T02:31:25.947Z","sourceNote":"XM SinerGox API (servapibi.xm.com.co/daily, MetricId=VertEner, Entity=Sistema). CSV relay fallback (1707-day committed CSV, latest: 2026-06-15). 5-yr baseline 7.53 TWh/yr (range 0.53–13.12 TWh/yr ENSO-driven). Bimodal Colombian hydro-seasonal shape (Apr–Jun + Oct–Nov peaks). T1b, ±50% envelope. — current 30-day seasonal factor 1.39×","confidenceTier":"T1b-live-domestic-anchored","uncertaintyLowGW":1.0018242273972604,"uncertaintyHighGW":3.0054726821917814,"sourceStatus":"live","sourceProvenance":"verified"}