{"regionId":"kazakhstan","profile":[0.03797775926105071,0.03671349560318388,0.03605906457781005,0.03605906457781005,0.03671349560318388,0.03797775926105071,0.039765698072421404,0.041955466962009635,0.04439783679875416,0.046926364114487834,0.049368733951232355,0.051558502840820586,0.053346441652191275,0.054610705310058114,0.05526513633543194,0.05526513633543194,0.054610705310058114,0.053346441652191275,0.051558502840820586,0.049368733951232355,0.046926364114487834,0.04439783679875416,0.041955466962009635,0.039765698072421404],"latestProfile":null,"totalTWh":0.03287671232876712,"peakGW":0.05526513633543194,"lastUpdated":"2024","sourceNote":"Typical-shape fallback: KEGOC live feed unavailable (KEGOC public pages do not expose machine-readable hourly curtailment; market operator data is login-gated); Aktobe transmission-limited wind curtailment scaled to ~0.4 TWh/yr (Qazaq Green 2024: ~7.5 TWh RES with 5-8% systemic curtailment).","confidenceTier":"T3-modelled","uncertaintyLowGW":0.03315908180125916,"uncertaintyHighGW":0.07737119086960471,"lastSuccessAt":"2026-04-25T22:39:32.558Z","sourceProvenance":"modelled-fallback"}