{"regionId":"indonesia","profile":[0.023349781279900384,0.05384882829801029,0.08673839986149708,0.11409826761121389,0.12955519934804094,0.12955519934804094,0.11409826761121389,0.08673839986149708,0.05384882829801029,0.023349781279900384,0.003368427710926367,0,0,0,0,0,0,0,0,0,0,0,0,0.0033684277109263462],"latestProfile":null,"totalTWh":0.024657534246575342,"peakGW":0.12955519934804094,"lastUpdated":"2024","sourceNote":"Typical-shape fallback: PLN live feed unavailable (PLN public pages do not expose machine-readable hourly curtailment); calibration anchor ~0.3 TWh/yr Java-Bali solar curtailment.","confidenceTier":"T3-modelled","uncertaintyLowGW":0.07773311960882456,"uncertaintyHighGW":0.18137727908725731,"lastSuccessAt":"2026-04-25T22:39:32.558Z","sourceProvenance":"modelled-fallback"}